{
  "spec": "alms.dev/runtime-audit-fixture/v0",
  "id": "generation-basic-001",
  "feature": "generation",
  "summary": "Basic single-turn text generation returns non-empty assistant content.",
  "messages": [
    {
      "role": "user",
      "parts": [{ "kind": "text", "text": "Reply with the single word: pong." }]
    }
  ],
  "requirements": {
    "live_required": true,
    "supports_mock_mode": true,
    "capabilities": ["generation"],
    "tier": "base"
  },
  "execution": {
    "temperature": 0,
    "max_output_tokens": 16,
    "timeout_ms": 30000,
    "stream": false,
    "max_attempts": 1
  },
  "expected_invariants": {
    "non_empty_assistant_content": true
  }
}
